{
  "toolId": "refund.eligibility.check",
  "version": "1.2.0",
  "domain": "refund",
  "name": "检查退款资格",
  "description": "检查指定订单当前是否满足退款条件，返回是否可退、可退金额与不可退原因。只读，无副作用。",
  "protocol": "in-process",
  "inputSchema": {
    "type": "object",
    "additionalProperties": false,
    "required": ["orderId"],
    "properties": {
      "orderId": { "type": "string", "minLength": 1, "maxLength": 64 }
    }
  },
  "outputSchema": {
    "type": "object",
    "additionalProperties": false,
    "required": ["orderId", "eligible", "refundableAmount", "currency"],
    "properties": {
      "orderId": { "type": "string" },
      "eligible": { "type": "boolean" },
      "refundableAmount": { "type": "string", "pattern": "^-?\\d+(\\.\\d{1,2})?$" },
      "currency": { "type": "string", "enum": ["CNY"] },
      "reason": { "type": "string", "maxLength": 200 }
    }
  },
  "risk": {
    "level": "low",
    "sideEffect": false,
    "reversible": true,
    "confirmation": "never"
  },
  "authorization": {
    "permission": "refund:read"
  },
  "execution": {
    "timeoutMs": 3000,
    "maxRetries": 1,
    "idempotency": "none"
  },
  "owner": {
    "team": "refund-platform"
  },
  "status": "active"
}
